{"name":"Sample API spec describing account and roles relation","version":"0.0.1","created":"2021-03-24T02:41:41.035Z","description":"Auto generated RESTORMJS api from public schema using restorm-pg-spec","paths":{"account_roles":{"name":"Account_roles","path":"account_roles","auth":false,"table":"account_roles","schema":"public","grants":"CRUD","fields":{"grant_date":{"name":"grant_date","type":"string","required":false,"column":"grant_date","grants":"CRU"},"role_id":{"name":"role_id","type":"number","required":true,"column":"role_id","grants":"CRU"},"user_id":{"name":"user_id","type":"number","required":true,"column":"user_id","grants":"CRU"}}},"accounts":{"name":"Accounts","path":"accounts","auth":false,"table":"accounts","schema":"public","grants":"CRUD","fields":{"id":{"name":"id","type":"number","required":false,"column":"user_id","grants":"CRU"},"created_on":{"name":"created_on","type":"string","required":true,"column":"created_on","grants":"CRU"},"email":{"name":"email","type":"string","required":true,"column":"email","grants":"CRU"},"last_login":{"name":"last_login","type":"string","required":false,"column":"last_login","grants":"CRU"},"password":{"name":"password","type":"string","required":true,"column":"password","grants":"CRU"},"username":{"name":"username","type":"string","required":true,"column":"username","grants":"CRU"}}},"roles":{"name":"Roles","path":"roles","auth":false,"table":"roles","schema":"public","grants":"CRUD","fields":{"id":{"name":"id","type":"number","required":false,"column":"role_id","grants":"CRU"},"role_name":{"name":"role_name","type":"string","required":true,"column":"role_name","grants":"CRU"}}}}}
