{
  "name":"RESTORMJS Test API Spec",
  "version":"0.0.1",
  "created":"2021-03-05T05:09:07.729Z",
  "description":"A simple spec for unit tests",
  "paths":{
    "account_roles":{
      "name":"Account_roles",
      "path":"account_roles",
      "protected":false,
      "db_table":"account_roles",
      "db_schema":"public",
      "operations":"CRUD",
      "fields":{
        "grant_date":{
          "name":"grant_date",
          "type":"string",
          "is_required":false,
          "column_name":"grant_date"
        },
        "role_id":{
          "name":"role_id",
          "type":"number",
          "is_required":true,
          "column_name":"role_id"
        },
        "user_id":{
          "name":"user_id",
          "type":"number",
          "is_required":true,
          "column_name":"user_id"
        }
      }
    },
    "accounts":{
      "name":"Accounts",
      "path":"accounts",
      "protected":false,
      "db_table":"accounts",
      "db_schema":"public",
      "operations":"CRUD",
      "fields":{
        "id":{
          "name":"id",
          "type":"number",
          "is_required":false,
          "column_name":"user_id"
        },
        "created_on":{
          "name":"created_on",
          "type":"string",
          "is_required":true,
          "column_name":"created_on"
        },
        "email":{
          "name":"email",
          "type":"string",
          "is_required":true,
          "column_name":"email"
        },
        "last_login":{
          "name":"last_login",
          "type":"string",
          "is_required":false,
          "column_name":"last_login"
        },
        "password":{
          "name":"password",
          "type":"string",
          "is_required":true,
          "column_name":"password"
        },
        "username":{
          "name":"username",
          "type":"string",
          "is_required":true,
          "column_name":"username"
        }
      }
    },
    "roles":{
      "name":"Roles",
      "path":"roles",
      "protected":false,
      "db_table":"roles",
      "db_schema":"public",
      "operations":"CRUD",
      "fields":{
        "id":{
          "name":"id",
          "type":"number",
          "is_required":false,
          "column_name":"role_id"
        },
        "role_name":{
          "name":"role_name",
          "type":"string",
          "is_required":true,
          "column_name":"role_name"
        }
      }
    }
  }
}
