{"name":"Horizon API","version":"0.0.1","created":"2021-02-17T04:58:39.921Z","description":"Auto generated horizon api from public db schema using db2api","paths":{"playground":{"name":"Playground","path":"playground","protected":false,"db_table":"playground","db_schema":"public","operations":"CRUD","fields":{"id":{"name":"id","type":"number","is_required":false,"column_name":"equip_id"},"color":{"name":"color","type":"string","is_required":true,"column_name":"color"},"install_date":{"name":"install_date","type":"string","is_required":false,"column_name":"install_date"},"location":{"name":"location","type":"string","is_required":false,"column_name":"location"},"type":{"name":"type","type":"string","is_required":true,"column_name":"type"}}}}}